{
  "$schema": "../../../../schemas/v1/capability-status.schema.json",
  "contract_version": "1.0",
  "gateway_state": "indeterminate",
  "request_digest": "sha256:d74624c1ee49c193a4077e8833d91a9aaff1575bdcfc412a116153078d01059d",
  "request_id": "request-example-001",
  "updated_at": "2026-08-05T20:00:04Z",
  "error": {
    "code": "manifest.invalid",
    "message": "Synthetic uncertainty",
    "retryable": false
  }
}
