{
  "$schema": "../../../../schemas/v1/capability-status.schema.json",
  "contract_version": "1.0",
  "gateway_state": "indeterminate",
  "provider_operation": {
    "operation_ref": "operation:synthetic:001",
    "phase": "indeterminate",
    "provider_ref": "provider:example-noop:001"
  },
  "request_digest": "sha256:d74624c1ee49c193a4077e8833d91a9aaff1575bdcfc412a116153078d01059d",
  "request_id": "request-example-001",
  "updated_at": "2026-08-05T20:00:04Z",
  "error": {
    "code": "provider.recovery",
    "message": "Synthetic uncertainty",
    "retryable": true
  }
}
